{
  "gate_profile_id": "VOICE_P0",
  "description": "AGT-VOICE 语音门禁：架构适应度 + OpenAI Audio 适配器与热拔插测试",
  "risk_class": "medium",
  "stages": [
    {
      "stage": 1,
      "name": "Architecture Fitness & Boundaries",
      "cwd": ".",
      "command": [
        "python3",
        "scripts/check_architecture_fitness.py"
      ],
      "expects": [
        "scripts/check_architecture_fitness.py"
      ]
    },
    {
      "stage": 2,
      "name": "Audio Adapter Tests",
      "cwd": "engine",
      "command": [
        "uv",
        "run",
        "--locked",
        "--extra",
        "dev",
        "pytest",
        "-q",
        "tests/test_audio_adapter.py"
      ],
      "expects": [
        "engine/tests/test_audio_adapter.py"
      ]
    }
  ]
}
